{
  "$schema": "http://json-schema.org/draft-07/schema#",
  "title": "Cybersecurity Dictionary Term",
  "type": "object",
  "additionalProperties": false,
  "required": [
    "name",
    "slug",
    "definition",
    "category",
    "synonyms",
    "see_also",
    "sources"
  ],
  "properties": {
    "name": {
      "type": "string",
      "minLength": 1
    },
    "slug": {
      "type": "string",
      "pattern": "^[a-z0-9-]+$"
    },
    "definition": {
      "type": "string",
      "minLength": 1
    },
    "category": {
      "type": "string",
      "minLength": 1
    },
    "synonyms": {
      "type": "array",
      "items": {
        "type": "string"
      },
      "minItems": 1
    },
    "see_also": {
      "type": "array",
      "items": {
        "type": "string"
      },
      "minItems": 1
    },
    "sources": {
      "type": "array",
      "items": {
        "type": "string",
        "format": "uri"
      },
      "minItems": 1
    }
  }
}
